### ISSUE TITLE
Bug: FetchResponse decode may overwrite topic partition

### ISSUE THREAD

**Issue by maralla** [IBM/sarama#1905]
##### Versions

*Please specify real version numbers or git SHAs, not just "Latest" since that changes fairly regularly.*

| Sarama | Kafka | Go |
|--------|-------|----|
| 1.23.1 | 2.2.0 | 1.13.4 |
| 1.27.2 | 2.2.0 | 1.13.4 |

##### Configuration

What configuration values are you using for Sarama and Kafka?
``` go
```

##### Logs

When filing an issue please provide logs from Sarama and Kafka if at all
possible. You can set `sarama.Logger` to a `log.Logger` to capture Sarama debug
output.

<details><summary>logs: CLICK ME</summary>
<p>

```
[xxx] 2021/03/19 15:30:26 consumer/broker/103 added subscription to xxx2_topic/2
[xxx] 2021/03/19 15:30:26 consumer/broker/103 added subscription to xxx1_topic/3
[xxx] 2021/03/19 15:30:26 consumer/broker/103 added subscription to xxx2_topic/5
[xxx] 2021/03/19 15:30:26 consumer/broker/103 abandoned subscription to xxx2_topic/2 because kafka: response did not contain all the expected topic/partition blocks
[xxx] 2021/03/19 15:30:26 consumer/broker/103 abandoned subscription to xxx1_topic/3 because kafka: response did not contain all the expected topic/partition blocks
[xxx] 2021/03/19 15:30:26 consumer/broker/103 abandoned subscription to xxx2_topic/5 because kafka: response did not contain all the expected topic/partition blocks

```

</p>
</details>

##### Problem Description

We use sarama as our Kafka client in the production environment. We found the following logs in the log file of our consumer workers:

```text
kafka: error while consuming xxx_topic/2: kafka: response did not contain all the expected topic/partition blocks
```

And the messages in the partitions contained in the logs `... xxx_topic/2 ...` can not be consumed. 

We investigated the problem. We tried other clients [kafka-python](https://github.com/dpkp/kafka-python), [confluent-kafka-go](https://github.com/confluentinc/confluent-kafka-go) and Kafka Java client and are all very normal. We already used sarama for a long time without any problem. Until recently an app is using a Kafka cluster provided by a cloud service start to show the problem. I think the problem is not easy to reproduce because the Kafka provided be the cloud service may different from official version. 

Here is the tcpdump result of FetchRequest and FetchResponse frame:

FetchRequest:
```
Frame 150: 235 bytes on wire (1880 bits), 235 bytes captured (1880 bits)
Ethernet II, Src: 00:16:3e:02:5a:0d, Dst: ee:ff:ff:ff:ff:ff
Internet Protocol Version 4, Src: 10.14.31.146, Dst: 10.14.8.29
Transmission Control Protocol, Src Port: 32794, Dst Port: 9092, Seq: 2008, Ack: 1507, Len: 169
Kafka (Fetch v4 Request)
    Length: 165
    API Key: Fetch (1)
    API Version: 4
    Correlation ID: 28
    Client ID: sarama
    Replica ID: -1
    Max Wait Time: 250
    Min Bytes: 1
    Max Bytes: 104857600
    Isolation Level: Read Uncommitted (0)
    Topic (3 partitions)
        Topic Name: xxx1_topic
        Partition (ID=2, Offset=18)
        Partition (ID=5, Offset=18)
        Partition (ID=3, Offset=22)
    Topic (3 partitions)
        Topic Name: xxx2_topic
        Partition (ID=5, Offset=25)
        Partition (ID=1, Offset=21)
        Partition (ID=2, Offset=33)
```

FetchResponse:
```
Frame 176: 116 bytes on wire (928 bits), 116 bytes captured (928 bits)
Ethernet II, Src: ee:ff:ff:ff:ff:ff, Dst: 00:16:3e:02:5a:0d
Internet Protocol Version 4, Src: 10.14.8.29, Dst: 10.14.31.146
Transmission Control Protocol, Src Port: 9092, Dst Port: 32794, Seq: 1717, Ack: 2177, Len: 50
[11 Reassembled TCP Segments (260 bytes): #164(8), #165(8), #166(12), #167(30), #169(20), #170(30), #171(30), #172(12), #173(30), #174(30), #176(50)]
Kafka (Fetch v4 Response)
    Length: 256
    Correlation ID: 28
    [Request Frame: 150]
    [API Key: Fetch (1)]
    [API Version: 4]
    Throttle time: 0
    Topic (1 partitions)
        Topic Name: xxx1_topic
        Partition (ID=3, Offset=22)
    Topic (2 partitions)
        Topic Name: xxx2_topic
        Partition (ID=5, Offset=25)
        Partition (ID=2, Offset=33)
    Topic (2 partitions)
        Topic Name: xxx1_topic
        Partition (ID=5, Offset=18)
        Partition (ID=2, Offset=18)
    Topic (1 partitions)
        Topic Name: xxx2_topic
        Partition (ID=1, Offset=21)
```

Let me post the code decoding FetchResponse here:

*The code is from master (41df78df10a9ef3c807cbe1f2814001e330fbdf1) branch fetch_response.go `(*FetchResponse).decode`. The versions we tested are the same*.

```go
// ...
	numTopics, err := pd.getArrayLength()
	if err != nil {
		return err
	}

	r.Blocks = make(map[string]map[int32]*FetchResponseBlock, numTopics)
	for i := 0; i < numTopics; i++ {
		name, err := pd.getString()
		if err != nil {
			return err
		}

		numBlocks, err := pd.getArrayLength()
		if err != nil {
			return err
		}

		r.Blocks[name] = make(map[int32]*FetchResponseBlock, numBlocks)

		for j := 0; j < numBlocks; j++ {
			id, err := pd.getInt32()
			if err != nil {
				return err
			}

			block := new(FetchResponseBlock)
			err = block.decode(pd, version)
			if err != nil {
				return err
			}
			r.Blocks[name][id] = block
		}
	}
// ...
```
In the tcpdump result of FetchResponse there four Topics, so  `numTopics` is 4, in the `for` loop when starting parse the topic partition info a new `map` is created and overwrites the whole topic key in `r.Blocks`. So I think topics already stored in `r.Blocks` will be overwritten by the following topic partition with the same name. So after all topic looped some partitions will not be contained in `r.Blocks` so problem happens.

**Comment by dnwe** [comment]
Thanks, this looks interesting. I'm surprised to see the FetchResponse split like this, would be interesting to know if it is a caused by a Cloud-service modification over vanilla Kafka.

Either way it sounds like we should be able to cope with it anyway.

**Comment by maralla** [comment]
Yes. We contacted the cloud provider and they said they did many performance impovements which includes the FetchResponse related modification. So I think the problem is caused by the modification. But anyway the protocol level format of FetchResponse still obey the official Kafka definition. 

I think it's better to make sarama support this situation. As many other client implementations can handle this.
