### ISSUE TITLE
producer  write broken pipe

### ISSUE THREAD

**Issue by chowyu08** [IBM/sarama#1565]
##### Versions

*V1.24.1*

| Sarama | Kafka | Go |
|--------|-------|----|
| 1.24.1 |Kafka 2.1.1  |1.13.1  |

##### Configuration

What configuration values are you using for Sarama and Kafka?
``` go
conf := sarama.NewConfig()
	conf.Version = sarama.V2_0_0_0
	conf.Producer.RequiredAcks = sarama.WaitForLocal
	conf.ChannelBufferSize = 1024
	conf.Net.KeepAlive = 30 * time.Second
```

##### Logs

<details><summary>logs: CLICK ME</summary>
<p>

time="2019-12-25T09:15:51Z" level=info msg="producer/broker/3 state change to [closing] because write tcp xxxxx:59382->xxxx:9092: write: broken pipe\n"
time="2019-12-25T09:15:51Z" level=info msg="producer/broker/2 state change to [closing] because write tcp xxxx:33336->xxxx:9092: write: broken pipe\n"
time="2019-12-25T09:15:51Z" level=info msg="Closed connection to broker xxxx:9092\n"
time="2019-12-25T09:15:51Z" level=info msg="producer/leader/metric.transfer/0 state change to [retrying-1]\n"
time="2019-12-25T09:15:51Z" level=info msg="producer/leader/metric.transfer/0 abandoning broker 3\n"
time="2019-12-25T09:15:51Z" level=info msg="Closed connection to broker xxxx:9092\n"
time="2019-12-25T09:15:51Z" level=info msg="producer/broker/3 input chan closed\n"
time="2019-12-25T09:15:51Z" level=info msg="producer/broker/3 shut down\n"
time="2019-12-25T09:15:51Z" level=info msg="producer/leader/msg.republish/1 state change to [retrying-1]\n"
time="2019-12-25T09:15:51Z" level=info msg="producer/leader/msg.republish/1 abandoning broker 2\n"
time="2019-12-25T09:15:51Z" level=info msg="producer/leader/metric.hit/0 state change to [retrying-1]\n"
time="2019-12-25T09:15:51Z" level=info msg="producer/leader/metric.hit/0 abandoning broker 2\n"
time="2019-12-25T09:15:51Z" level=info msg="producer/broker/2 input chan closed\n"
time="2019-12-25T09:15:51Z" level=info msg="producer/broker/2 shut down\n"
time="2019-12-25T09:15:51Z" level=info msg="client/metadata fetching metadata for [metric.transfer] from broker xxxx:9092\n"
time="2019-12-25T09:15:51Z" level=info msg="client/metadata fetching metadata for [msg.republish] from broker xxxx:9092\n"
time="2019-12-25T09:15:51Z" level=info msg="client/metadata fetching metadata for [metric.hit] from broker xxxx:9092\n"
time="2019-12-25T09:15:51Z" level=info msg="client/brokers replaced registered broker #1 with xxxx:9092"
time="2019-12-25T09:15:51Z" level=info msg="ClientID is the default of 'sarama', you should consider setting it to something application-specific."
time="2019-12-25T09:15:51Z" level=info msg="producer/broker/3 starting up\n"
time="2019-12-25T09:15:51Z" level=info msg="producer/broker/3 state change to [open] on metric.transfer/0\n"
time="2019-12-25T09:15:51Z" level=info msg="client/brokers replaced registered broker #1 with xxxx:9092"
time="2019-12-25T09:15:51Z" level=info msg="ClientID is the default of 'sarama', you should consider setting it to something application-specific."
time="2019-12-25T09:15:51Z" level=info msg="producer/leader/metric.transfer/0 selected broker 3\n"
time="2019-12-25T09:15:51Z" level=info msg="producer/leader/metric.transfer/0 state change to [flushing-1]\n"
time="2019-12-25T09:15:51Z" level=info msg="producer/leader/metric.transfer/0 state change to [normal]\n"
time="2019-12-25T09:15:51Z" level=info msg="producer/broker/2 starting up\n"
time="2019-12-25T09:15:51Z" level=info msg="producer/broker/2 state change to [open] on metric.ruleengine.hit/0\n"
time="2019-12-25T09:15:51Z" level=info msg="client/brokers replaced registered broker #1 with xxxx:9092"
time="2019-12-25T09:15:51Z" level=info msg="producer/leader/metric.hit/0 selected broker 2\n"
time="2019-12-25T09:15:51Z" level=info msg="producer/leader/msg.republish/1 selected broker 2\n"
time="2019-12-25T09:15:51Z" level=info msg="producer/broker/2 state change to [open] on msg.republish/1\n"
time="2019-12-25T09:15:51Z" level=info msg="producer/leader/msg.republish/1 state change to [flushing-1]\n"
time="2019-12-25T09:15:51Z" level=info msg="producer/leader/msg.republish/1 state change to [normal]\n"
time="2019-12-25T09:15:51Z" level=info msg="producer/leader/metric.hit/0 state change to [flushing-1]\n"
time="2019-12-25T09:15:51Z" level=info msg="producer/leader/metric.hit/0 state change to [normal]\n"
time="2019-12-25T09:15:52Z" level=info msg="Connected to broker at xxxx:9092 (registered as #2)\n"
time="2019-12-25T09:15:53Z" level=info msg="Connected to broker at xxxx:9092 (registered as #3)\n"

</p>
</details>

##### Problem Description

After 10 minutes, the producer scoket write broken pipe.

**Comment by talbspx** [comment]
👍 
experiencing similar behaviour with 
kafka : 0.10.2.1
go : 1.13
sarma : 1.24.1 SyncProducer

**Comment by talbspx** [comment]
update: 
this comes from kafka - `connections.max.idle.ms` setting to default 10 minutes.
kafka removes idle connections for producers that longer than `connections.max.idle.ms`.
two possible ways to overcome this -
1. Feature request to sarama - since kafka 0.11 it is possible to send a metadata request which will mimic a heartbeat from the producer to the broker which will make a the connection live.
2. set `connections.max.idle.ms` config on the broker side to be high enough value to the expected time your producer should produce a message thus keeping the connection alive all the time.

**Comment by dnwe** [comment]
So the client does already run a periodic metadata refresh based on backgroundMetadata goroutine in client.go which ticks on `client.conf.Metadata.RefreshFrequency` which defaults to 10m so you could reduce that to cause it to happen more frequently. 

https://github.com/Shopify/sarama/blob/6159078aacb29adb9ecbd2a83ab9c2732c80add2/client.go#L768

However, that is sent to a random broker each time so won't necessarily keep alive your idle connections to all of the brokers in the cluster

**Comment by talbspx** [comment]
thanks for the quick reply 👍 

so i have seen this configuration and set it to 5min (kafka broker remains on 10min for idle connection)
on local single kafka broker and this is still happening.

LOGS : <TBD>

**Comment by dnwe** [comment]
@talbspx interesting. If it's just local single broker instance can you change the idle broker config to 2m, set Sarama to 60s refresh and enable debug logs on the broker side? I'll also try and reproduce in the week if I can

**Comment by talbspx** [comment]
yeah np :)
will try to have it later on today.

**Comment by d1egoaz** [comment]
Interested, we've seen lots of these lately.

**Comment by talbspx** [comment]
@d1egoaz  @dnwe 
to me it seems like the is an issue with the way that the channel keys are handled in the kafka broker might have an issue on v 0.10.x . (code looks a bit different under trunk)
here -> https://github.com/apache/kafka/blob/0.10.2.2/clients/src/main/java/org/apache/kafka/common/network/Selector.java#L312-L314
i


i have increased the log level to trace under the kafka server , 
it seems the Selector

**Comment by talbspx** [comment]
@d1egoaz @dnwe
to me it seems like the is an issue with the way that the channel keys are handled in the kafka broker on v0.10.x . (code looks a bit different under trunk)

is where the server socket polls the Processor channels and update its state using the processor.Selector:
https://github.com/apache/kafka/blob/0.10.2.2/core/src/main/scala/kafka/network/SocketServer.scala#L494

then the Selector iterates over the channels and tries to update the channel state
https://github.com/apache/kafka/blob/0.10.2.2/clients/src/main/java/org/apache/kafka/common/network/Selector.java#L312-L314

update the idlemanager over each channel key
https://github.com/apache/kafka/blob/0.10.2.2/clients/src/main/java/org/apache/kafka/common/network/Selector.java#L339

and eventually release the channel if needed
https://github.com/apache/kafka/blob/0.10.2.2/clients/src/main/java/org/apache/kafka/common/network/Selector.java#L324

so i believe the issue is with the SelectedKeys that are retrieved (managed) using the java.nio.Selector
https://docs.oracle.com/javase/7/docs/api/java/nio/channels/Selector.html

**Comment by sshahar1** [comment]
I am also interested in this issue. I am experiencing it with:
Sarama version v1.26.3
Kafka version 2.6.0
Go version 1.12

This is quite a mission critical application, so I do need to fix this.

**Comment by DasTushar** [comment]
Interested in this issue. I'm experiencing it with:

Sarama version v1.27.2
Go version 1.14

**Comment by caiofralmeida** [comment]
Interested in this issue. I'm experiencing it with:

Sarama version v1.28.0
Go version 1.15

**Comment by mster429** [comment]
Experiencing the same issue with the recent sarama version upgrade v1.29.1 and go-1.15.6. Any help in figuring out the cause is appreciated. The producer client is running on a k8s container with 1 core and 2 GiB memory.

**Comment by HY1310** [comment]
@dnwe we also met this issue and in our tcpdump seems it's sarama initiated the close action, but haven't located the place in code yet 

16:54:12.951706 IP db-xxxx-xxxx-v5-00-slave-10-65-235-23.24132 > 10.129.19.169.XmlIpcRegSvc: Flags [F.], seq 1, ack 1, win 229, length 0
16:54:12.951797 IP db-xxxx-xxxx-v5-00-slave-10-65-235-23.24140 > 10.129.19.169.XmlIpcRegSvc: Flags [F.], seq 1, ack 1, win 229, length 0
16:54:12.951797 IP db-xxxx-xxxx-v5-00-slave-10-65-235-23.24144 > 10.129.19.169.XmlIpcRegSvc: Flags [F.], seq 1, ack 1, win 229, length 0
16:54:12.951820 IP db-xxxx-xxxx-v5-00-slave-10-65-235-23.24080 > 10.129.19.169.XmlIpcRegSvc: Flags [F.], seq 70, ack 52228, win 1048, length 0
16:54:12.951835 IP db-xxxx-xxxx-v5-00-slave-10-65-235-23.24150 > 10.129.19.169.XmlIpcRegSvc: Flags [F.], seq 1, ack 1, win 229, length 0
16:54:12.951858 IP db-xxxx-xxxx-v5-00-slave-10-65-235-23.24158 > 10.129.19.169.XmlIpcRegSvc: Flags [F.], seq 1, ack 1, win 229, length 0
16:54:12.952963 IP 10.129.19.169.XmlIpcRegSvc > db-xxxx-xxxx-v5-00-slave-10-65-235-23.24158: Flags [F.], seq 1, ack 2, win 7300, length 0
16:54:12.953224 IP 10.129.19.169.XmlIpcRegSvc > db-xxxx-xxxx-v5-00-slave-10-65-235-23.24132: Flags [F.], seq 1, ack 2, win 7300, length 0
16:54:12.953617 IP 10.129.19.169.XmlIpcRegSvc > db-xxxx-xxxx-v5-00-slave-10-65-235-23.24140: Flags [F.], seq 1, ack 2, win 7300, length 0
16:54:12.953956 IP 10.129.19.169.XmlIpcRegSvc > db-xxxx-xxxx-v5-00-slave-10-65-235-23.24150: Flags [F.], seq 1, ack 2, win 7300, length 0
16:54:12.953975 IP 10.129.19.169.XmlIpcRegSvc > db-xxxx-xxxx-v5-00-slave-10-65-235-23.24144: Flags [F.], seq 1, ack 2, win 7300, length 0
16:54:12.955397 IP 10.129.19.169.XmlIpcRegSvc > db-xxxx-xxxx-v5-00-slave-10-65-235-23.24080: Flags [F.], seq 52228, ack 71, win 7300, length 0

**Comment by baoxc-shopee** [comment]
> update: this comes from kafka - `connections.max.idle.ms` broker config that defaults to 10 minutes. kafka removes idle connections for producers that longer than `connections.max.idle.ms`. two possible ways to overcome this -
> 
> 1. Feature request to sarama - since kafka 0.11 it is possible to send a metadata request which will mimic a heartbeat from the producer to the broker in which the connection remains alive.
> 2. set `connections.max.idle.ms` config on the broker side to be high enough value to the expected time your producer should produce a message thus keeping the connection alive all the time.

Hi I met the same issue and could you share how can i send a metadata refresh as you said? Thanks a lot!

**Comment by king-freshket** [comment]
> Yes this is a bug. ~I believe the issue will be that the producer dispatcher func simply iterates over the `Input` channel blocking until new messages are put on the Input queue to send. If Kafka has closed the underlying broker connection in the mean time the producer currently won't realise until it next tries to send a message.~
> 
> Update: hmm after looking into this some more, the brokerProducer should account for the dropped connection and re-establish it fairly transparently anyway. Needs more investigation

any update

**Comment by Oguzyildirim** [comment]
> Yes this is a bug. ~I believe the issue will be that the producer dispatcher func simply iterates over the `Input` channel blocking until new messages are put on the Input queue to send. If Kafka has closed the underlying broker connection in the mean time the producer currently won't realise until it next tries to send a message.~
> 
> Update: hmm after looking into this some more, the brokerProducer should account for the dropped connection and re-establish it fairly transparently anyway. Needs more investigation

we are facing the same issue, any update?

**Comment by david-bergman** [comment]
Interested in this issue. I'm experiencing it with:

Sarama version v1.37.2
Go version 1.18

**Comment by david-bergman** [comment]
I am still experiencing this issue with the latest sarama
v1.38.2-0.20230327141928-9127f1c432c0 
periodically , so once every week or so, when it seems Confluent Kafka does some rolling upgrades on the cluster, i get this error, and then the worker hangs indefinitely. 
any plans to address this bug in future releases?

**Comment by dnwe** [comment]
With `connections.max.idle.ms ` enabled server side, this  _should_ have been fixed with https://github.com/IBM/sarama/pull/2197 and https://github.com/IBM/sarama/pull/2234 both merged

@david-bergman it sounds like you are still seeing issues — I wonder if you were inadvertently using sasl v0 in v1.38.1 and missing out on the re-auth. Since https://github.com/IBM/sarama/pull/2572 the default was (put back) to sasl v1 and we also have a lot better protocol support. Can you re-test with the latest release?
